{
    "name": "Bengaluru",
    "email": "akshayv2310@gmail.com",
    "phone": "+918105002310",
    "education": [
        {
            "university_name": "EXPERTISE\nBE in Computer Science\nThe Oxford College",
            "course_name": "Bengaluru\nDec 2022",
            "dates_attended": "2021",
            "marks_or_percentage": "",
            "additional_info": [
                "of Engineering\n2017- 2021\nUI/ UX Certification Course\nDesignboat,  - April 2023\nFigma\nGraphic Designer \nAdobeXD\nPhotoshop\nIllustrator\nHTML & CSS\nWebflow\n-Healofy \nOct 2021-Mar 2022\nAKSHAY\nUI/UX Designer"
            ]
        }
    ],
    "work_experience": [],
    "linkedin": "",
    "github": "",
    "projects": "PROFILE\nAs a UI/UX Designer, I am passionate about creating engaging digital \nexperiences that solve user problems and enhance brand perception. With \nexpertise in user research, wireframing, prototyping, and visual design, I \nstrive to craft intuitive and delightful interfaces that elevate the user \nexperience. I am adept at collaborating with cross-functional teams, \nleveraging user feedback, and staying up-to-date with industry trends and \nemerging technologies to deliver impactful and user-centric designs.\nCreated at Design Boat\nA Travel Application from scratch which includes IOS, Android and \nWeb Design\n\nI have  also done group User Research(UX Part) for the same \ndomain  \nCooking\nReading\nGaming\nFitness\nU I / U X  D e s i g n e r \n+91 8105002310 \nPhone\nakshayv2310@gmail.com \nRajajinagar,\nBengaluru, 560086 \nEmail\nAddress\nUI Design\nUX Research\nWireframing\nEDUCATION\nEXPERTISE\nBE in Computer Science\nThe Oxford College of Engineering\n2017- 2021\nUI/ UX Certification Course\nDesignboat, Bengaluru\nDec 2022 - April 2023\nFigma\nGraphic Designer \nAdobeXD\nPhotoshop\nIllustrator\nHTML & CSS\nWebflow\n-Healofy \nOct 2021-Mar 2022\nAKSHAY\nUI/UX Designer \nWORK EXPERIENCE \nInterests\nSkills\nProjects\nPROFILE\nAs a UI/UX Designer, I am passionate about creating engaging digital \nexperiences that solve user problems and enhance brand perception. With \nexpertise in user research, wireframing, prototyping, and visual design, I \nstrive to craft intuitive and delightful interfaces that elevate the user \nexperience. I am adept at collaborating with cross-functional teams, \nleveraging user feedback, and staying up-to-date with industry trends and \nemerging technologies to deliver impactful and user-centric designs.\nCreated at Design Boat\nA Travel Application from scratch which includes IOS, Android and \nWeb Design\n\nI have  also done group User Research(UX Part) for the same \ndomain  \nCooking\nReading\nGaming\nFitness\nU I / U X  D e s i g n e r \n+91 8105002310 \nPhone\nakshayv2310@gmail.com \nRajajinagar,\nBengaluru, 560086 \nEmail\nAddress\nUI Design\nUX Research\nWireframing\nEDUCATION\nEXPERTISE\nBE in Computer Science\nThe Oxford College of Engineering\n2017- 2021\nUI/ UX Certification Course\nDesignboat, Bengaluru\nDec 2022 - April 2023\nFigma\nGraphic Designer \nAdobeXD\nPhotoshop\nIllustrator\nHTML & CSS\nWebflow\n-Healofy \nOct 2021-Mar 2022\nAKSHAY\nUI/UX Designer \nWORK EXPERIENCE \nInterests\nSkills\nProjects\nPROFILE\nAs a UI/UX Designer, I am passionate about creating engaging digital \nexperiences that solve user problems and enhance brand perception. With \nexpertise in user research, wireframing, prototyping, and visual design, I \nstrive to craft intuitive and delightful interfaces that elevate the user \nexperience. I am adept at collaborating with cross-functional teams, \nleveraging user feedback, and staying up-to-date with industry trends and \nemerging technologies to deliver impactful and user-centric designs.\nCreated at Design Boat\nA Travel Application from scratch which includes IOS, Android and \nWeb Design\n\nI have  also done group User Research(UX Part) for the same \ndomain  \nCooking\nReading\nGaming\nFitness\nU I / U X  D e s i g n e r \nU I / U X  D e s i g n e r \n+91 8105002310 \nPhone\nakshayv2310@gmail.com \nRajajinagar,\nBengaluru, 560086 \nEmail\nAddress\nUI Design\nUX Research\nWireframing\nPrototype",
    "certifications": null,
    "extra": "",
    "skills": ""
}